{
  "schema_version": "r30j1c-r1.correction-record.v1",
  "status": "EMPTY_TEMPLATE",
  "item_id": null,
  "session_id": null,
  "context_family": null,
  "owner_decision": null,
  "owner_condition": "",
  "owner_note": "",
  "owner_written_response": "",
  "acceptable_alternatives": [],
  "fatigue_decision": null,
  "reason_codes": [],
  "normative_strength": "UNRESOLVED",
  "register": null,
  "persona_dimension": null,
  "source_family": null,
  "boundary_question": false,
  "review_hash": null,
  "completed_at": null,
  "evidence_class": "UNREVIEWED",
  "privacy_review_status": "NOT_APPLICABLE",
  "metadata_reconciliation_status": "NOT_APPLICABLE",
  "profile_inference_allowed": false,
  "gold_admission": false,
  "allowed_for_training": false,
  "training_started": false
}
